{
  "schema_version": "1.0.0",
  "delta_fix_plan_id": "delta-surgical-subject-integration",
  "project_id": "project-contract-test",
  "run_id": "run-delta-surgical-subject-integration",
  "critic_report_ref": {
    "artifact_id": "critic-subject-pasted",
    "artifact_version": "1.0.0",
    "artifact_uri": "mock://synthetic/critic-subject-pasted"
  },
  "generation_result_ref": {
    "artifact_id": "generation-critic-subject-pasted",
    "artifact_version": "1.0.0",
    "artifact_uri": "mock://synthetic/generation-critic-subject-pasted"
  },
  "final_frame_spec_ref": {
    "artifact_id": "frame-critic-subject-pasted",
    "artifact_version": "1.0.0",
    "artifact_uri": "mock://synthetic/frame-critic-subject-pasted"
  },
  "status": "READY",
  "strategy": "SURGICAL_DELTA",
  "return_depth": "TECHNICAL_DESIGN_ROOM",
  "responsible_nodes": [
    "VISUAL_SYSTEMS"
  ],
  "fixes": [
    {
      "fix_id": "fix-subject-contact-light",
      "issue_ref": "issue-subject-environment",
      "issue_category": "SUBJECT_ENVIRONMENT_INTEGRATION_FAILURE",
      "evidence_refs": [
        "ev-subject-pasted"
      ],
      "severity": "HIGH",
      "affected_region": {
        "region_id": "subject-contact-zone",
        "label": "Subject and environment contact zone",
        "geometry": {
          "kind": "NORMALIZED_BOX",
          "x": 0.32,
          "y": 0.45,
          "width": 0.42,
          "height": 0.42
        }
      },
      "violated_requirement": {
        "source_artifact": "FINAL_FRAME_SPEC",
        "source_path": "/subject_system/environment_integration",
        "requirement_id": "subject-integration",
        "statement": "Integrate subject lighting, contact, and atmosphere."
      },
      "responsible_node": "VISUAL_SYSTEMS",
      "return_depth": "TECHNICAL_DESIGN_ROOM",
      "protected_fields": [
        {
          "source_artifact": "FINAL_FRAME_SPEC",
          "field_path": "/identity_system",
          "reason": "Identity is approved and unrelated to the integration defect."
        },
        {
          "source_artifact": "FINAL_FRAME_SPEC",
          "field_path": "/composition_system",
          "reason": "Composition is already compliant."
        },
        {
          "source_artifact": "FINAL_FRAME_SPEC",
          "field_path": "/typography_system",
          "reason": "Copy and typography locks must remain unchanged."
        }
      ],
      "fields_that_must_not_change": [
        "/identity_system",
        "/composition_system",
        "/typography_system",
        "/reference_constraints"
      ],
      "requested_change": "Adjust only contact shadow, local light direction, edge spill, and atmospheric overlap around the subject contact zone.",
      "success_condition": {
        "observable_condition": "The subject shares the environment light, contact shadow, and atmospheric depth without changing identity, layout, copy, or reference semantics.",
        "verification_method": "IMAGE_CRITIC_RECHECK",
        "required_outcome": "PASS"
      },
      "change_scope": "VISUAL_SYSTEM",
      "forbidden_changes": [
        "Do not replace the subject.",
        "Do not recompose the frame.",
        "Do not change text.",
        "Do not add objects."
      ]
    }
  ],
  "global_protections": [
    {
      "source_artifact": "FINAL_FRAME_SPEC",
      "field_path": "/identity_system",
      "reason": "Identity is approved and unrelated to the integration defect."
    },
    {
      "source_artifact": "FINAL_FRAME_SPEC",
      "field_path": "/composition_system",
      "reason": "Composition is already compliant."
    },
    {
      "source_artifact": "FINAL_FRAME_SPEC",
      "field_path": "/typography_system",
      "reason": "Copy and typography locks must remain unchanged."
    }
  ],
  "execution_constraints": {
    "regenerate_entire_pipeline": false,
    "preserve_unaffected_regions": true,
    "allow_new_objects": false,
    "allow_copy_change": false,
    "allow_identity_change": false,
    "notes": [
      "Apply only the requested delta.",
      "Reject changes outside the affected region and declared fields."
    ]
  },
  "validation_plan": {
    "checks": [
      {
        "check_id": "validate-subject-integration-delta",
        "target_fix_ids": [
          "fix-subject-contact-light"
        ],
        "method": "IMAGE_CRITIC_RECHECK",
        "pass_condition": "Integration issue passes and every protected field remains unchanged."
      }
    ],
    "require_no_regression_on_protected_fields": true,
    "failure_action": "CREATE_NARROWER_DELTA"
  },
  "human_approval": {
    "status": "NOT_REQUIRED",
    "evidence_refs": []
  },
  "provenance": {
    "producer": "DELTA_FIX_PLANNER",
    "producer_version": "1.0.0-contract-test",
    "created_at": "2026-08-10T12:05:00.000Z",
    "sources": [
      "mock://synthetic/critic-subject-pasted"
    ],
    "data_classification": "SYNTHETIC_TEST_DATA",
    "notes": "TEST DATA ONLY. This fixture is not a real correction request or human decision."
  }
}
